Timestamp,EmailAddress,Title,Name,ProfilePicture,PersonalMantra,YourPersonalWebsiteLink,CoreResearchAreas,dblp
6/16/2023 8:00:00,skuttal@ncsu.edu,Associate Professor,Sandeep Kaur Kuttal,https://drive.google.com/open?id=1sRwYtmKB7GvWtDOwpTLjFZu3dQwzi_6a,Studying and modeling programmer behavior and then designing and developing mixed-initiative programmer-computer systems.,https://sandeepkuttal.github.io/kuttal/,"Human-Computer Interaction, Software Engineering, Artificial Intelligence, Education",https://dblp.org/pid/08/9798.xml
6/15/2023 10:27:00,mdamori@ncsu.edu,Associate Professor,Marcelo d'Amorim,https://drive.google.com/open?id=1FqqHspqZmDmJ49HfNM3wtjrhVyegBFjX,Make software more reliable and safer to everyone,https://damorim.github.io,Software Testing Software Debugging Program Repair,https://dblp.org/pid/16/608.xml
6/15/2023 13:12,ktstolee@ncsu.edu,Associate Professor,Kathryn (Katie) Stolee,https://drive.google.com/open?id=1T88WI1woUxbvPjspomn81ysNuUYZ6INT,make programming easier,https://kstolee.github.io/,code search program analysis program comprehension empirical studies,https://dblp.org/pid/26/694.xml
6/15/2023 14:47,wguezas@ncsu.edu,Associate Professor,Wesley K. G. Assunção,https://drive.google.com/open?id=1RjbyOeQFsHiLZO8ytuwvGnWXnVrvqRp5,"Investigates how to create and maintain software with the support of AI/ML, Model-Driven Engineering, and Systematic Reuse; providing customizable/flexible systems, with high quality standards, meeting technical, operational, and organizational needs.",https://wesleyklewerton.github.io/,Software Modernization Variability Management and Systematic Reuse Software Quality Model-Driven Engineering Collaboration in Systems Engineering Software Testing AI/ML for software engineering,https://dblp.org/pid/90/9459.xml
7/1/2023 9:51:42,bxu22@ncsu.edu,Assistant Professor,Bowen Xu,https://drive.google.com/open?id=1y-4RujA1jMqClrBgoAxpMEdkcLgLkeSq,Uncover optimal balance of software engineering,https://www.bowenxu.me/,Large Language Model of Code Software Text Analytics Bug/Vulnerability Analysis AI Security for SE,https://dblp.org/pid/89/5193.html
